Primera fecha: Fecha_Maxima,% Completion,Fecha_Compra,Descripción ,Proveedor,Estado_Entrega,Cantidad,Precio,Proyecto
2026-02-26 00:00:00,0.5142857142857142,2025-12-18 00:00:00,BOMBA SP,SCHWARZER PRECISION SALES GMBH,✅ A tiempo,10,$77318.57,STOCK ALMACÉN
2026-02-26 00:00:00,0.5142857142857142,2025-12-18 00:00:00,DIAFRAGMA BOMBA SP (REDONDO),SCHWARZER PRECISION SALES GMBH,✅ A tiempo,50,$77318.57,STOCK ALMACÉN
2026-02-08 00:00:00,0.1111111111111111,2026-01-21 00:00:00,SENSOR DE PRESION MPX 2010DP,NEWARK,✅ A tiempo,15,$177.83,STOCK ALMACÉN
2026-01-30 00:00:00,0,2026-01-23 00:00:00,FILTRO DE PAPEL MACRO,José Alfonso Echevarri,✅ A tiempo,600,$97363.90,MANTENIMIENTO CDMX Y EDOS. ( FEBRERO )
2026-01-30 00:00:00,0,2026-01-23 00:00:00,FILTRO IN LINE,José Alfonso Echevarri,✅ A tiempo,180,$97363.90,MANTENIMIENTO CDMX Y EDOS. ( FEBRERO )
2026-01-30 00:00:00,0,2026-01-23 00:00:00,FILTRO MALLA,José Alfonso Echevarri,✅ A tiempo,190,$97363.90,MANTENIMIENTO CDMX Y EDOS. ( FEBRERO )
